{
  "format": "rocklog.interchange",
  "formatVersion": 1,
  "weightUnit": "lb",
  "exportedAt": "2026-01-01T00:00:00Z",
  "kind": "backup",
  "payload": {
    "version": 1,
    "exportedAt": "2026-01-01T00:00:00Z",
    "exercises": [
      {
        "id": "11111111-1111-4111-8111-111111111111",
        "name": "Synthetic Press",
        "dayType": "Push",
        "muscleGroup": "Chest",
        "sortOrder": 0,
        "isCustom": true,
        "notes": "",
        "rotationTrack": "A",
        "extraDayTypes": "",
        "daySortOrdersRaw": "Push:0"
      }
    ],
    "sessions": [
      {
        "id": "22222222-2222-4222-8222-222222222222",
        "date": "2026-01-02T00:00:00Z",
        "dayType": "Push",
        "notes": "",
        "isCompleted": true,
        "exerciseRecords": [
          {
            "id": "33333333-3333-4333-8333-333333333333",
            "exerciseID": "11111111-1111-4111-8111-111111111111",
            "trainingMode": "Strength",
            "sortOrder": 0,
            "isCompleted": true,
            "notes": "",
            "sets": [
              {
                "id": "44444444-4444-4444-8444-444444444444",
                "setNumber": 1,
                "weightLbs": 135.125,
                "reps": 5,
                "isWarmup": false,
                "isEachSide": false,
                "isAssisted": false,
                "completedAt": "2026-01-02T00:00:00Z",
                "isTarget": false
              }
            ]
          }
        ],
        "rotationTrack": "A",
        "durationSeconds": 1800,
        "planState": "planned",
        "followsSessionRoster": true,
        "planOrder": 0
      }
    ],
    "splitDays": [
      {
        "id": "99999999-9999-4999-8999-999999999999",
        "name": "Push",
        "systemImage": "arrow.up",
        "subtitle": "Chest and shoulders",
        "colorHex": 16744448,
        "includesAllExercises": false,
        "sortOrder": 0
      }
    ],
    "dayPlans": [
      {
        "dayName": "Push",
        "exerciseIDs": ["11111111-1111-4111-8111-111111111111"]
      }
    ],
    "trainingBlocks": [
      {
        "id": "55555555-5555-4555-8555-555555555555",
        "name": "Synthetic Block",
        "notes": "",
        "startDate": "2026-01-01T00:00:00Z",
        "importedAt": "2026-01-01T00:00:00Z",
        "sessionIDs": ["22222222-2222-4222-8222-222222222222"]
      }
    ],
    "bodyMetrics": [
      {
        "id": "66666666-6666-4666-8666-666666666666",
        "date": "2026-01-01T00:00:00Z",
        "kindRaw": "weight",
        "value": 181.25,
        "note": ""
      }
    ]
  }
}
