{
  "format": "rocklog.interchange",
  "formatVersion": 1,
  "weightUnit": "lb",
  "exportedAt": "2026-01-01T00:00:00Z",
  "kind": "backup",
  "payload": {
    "version": 2,
    "exportedAt": "2026-01-01T00:00:00Z",
    "exercises": [
      {
        "id": "11111111-1111-4111-8111-111111111111",
        "name": "Synthetic Press",
        "dayType": "Push",
        "muscleGroup": "Chest",
        "sortOrder": 0,
        "isCustom": true,
        "notes": "",
        "defaultRestSeconds": 120,
        "autoRestEnabled": true,
        "loadModeRaw": "bar"
      }
    ],
    "sessions": [
      {
        "id": "22222222-2222-4222-8222-222222222222",
        "date": "2026-01-02T00:00:00Z",
        "dayType": "Push",
        "notes": "",
        "isCompleted": true,
        "exerciseRecords": [
          {
            "id": "33333333-3333-4333-8333-333333333333",
            "exerciseID": "11111111-1111-4111-8111-111111111111",
            "trainingMode": "Strength",
            "sortOrder": 0,
            "isCompleted": true,
            "notes": "",
            "sets": [
              {
                "id": "44444444-4444-4444-8444-444444444444",
                "setNumber": 1,
                "weightLbs": 135.125,
                "reps": 5,
                "isWarmup": false,
                "completedAt": "2026-01-02T00:00:00Z",
                "bodyWeightUsedLbs": 181.25
              }
            ]
          }
        ]
      }
    ],
    "trainingBlocks": [
      {
        "id": "55555555-5555-4555-8555-555555555555",
        "name": "Synthetic Block",
        "notes": "",
        "startDate": "2026-01-01T00:00:00Z",
        "importedAt": "2026-01-01T00:00:00Z",
        "sessionIDs": ["22222222-2222-4222-8222-222222222222"]
      }
    ],
    "bodyMetrics": [
      {
        "id": "66666666-6666-4666-8666-666666666666",
        "date": "2026-01-01T00:00:00Z",
        "kindRaw": "weight",
        "value": 181.25,
        "note": ""
      }
    ],
    "stackProfiles": [
      {
        "id": "77777777-7777-4777-8777-777777777777",
        "gymID": "88888888-8888-4888-8888-888888888888",
        "exerciseID": "11111111-1111-4111-8111-111111111111",
        "stepPounds": 0,
        "pinsRaw": "20,22.5",
        "pinUnitRaw": "kg",
        "addOnsRaw": "",
        "policyRaw": "nearest",
        "originRaw": "typed",
        "learnedSessionIDsRaw": "",
        "clearedAt": "2025-12-01T00:00:00Z",
        "learningEnabled": false,
        "rangeMin": 0,
        "rangeMax": 0
      }
    ]
  }
}
