{
  "format": "rocklog.interchange",
  "formatVersion": 1,
  "weightUnit": "lb",
  "exportedAt": "2026-01-01T00:00:00Z",
  "kind": "split",
  "payload": {
    "format": "rocklog.split",
    "version": 1,
    "labNote": "synthetic",
    "days": [{ "name": "Push", "exercises": ["Bench Press"] }]
  }
}
